{
  "$schema": "https://json-schema.org/draft/2020-12/schema",
  "$id": "https://agent-ci.invalid/schemas/release.v2.json",
  "$comment": "Informative contract sketch. src/release.ts and the candidate-credential policy core are authoritative and add filesystem, capture, process-name, and grant checks that JSON Schema cannot express.",
  "title": "OutcomeGate release manifest v2",
  "type": "object",
  "required": [
    "schemaVersion",
    "name",
    "runtime",
    "bundle",
    "model",
    "components",
    "candidate"
  ],
  "properties": {
    "schemaVersion": { "const": "agentci.release.v2" },
    "name": { "type": "string", "minLength": 1 },
    "runtime": {
      "type": "object",
      "required": ["kind", "protocolVersion", "entry"],
      "properties": {
        "kind": { "const": "node-jsonl" },
        "protocolVersion": { "const": 1 },
        "entry": { "$ref": "#/$defs/path" }
      },
      "additionalProperties": false
    },
    "bundle": {
      "type": "object",
      "required": ["root"],
      "properties": { "root": { "$ref": "#/$defs/path" } },
      "additionalProperties": false
    },
    "model": {
      "oneOf": [
        {
          "type": "object",
          "required": ["kind", "reason"],
          "properties": {
            "kind": { "const": "none" },
            "reason": { "type": "string", "minLength": 1 }
          },
          "additionalProperties": false
        },
        {
          "type": "object",
          "required": ["kind", "provider", "identifier", "revision"],
          "properties": {
            "kind": { "const": "remote" },
            "provider": { "type": "string", "minLength": 1 },
            "identifier": { "type": "string", "minLength": 1 },
            "revision": { "type": "string", "minLength": 1 },
            "configuration": {}
          },
          "additionalProperties": false
        },
        {
          "type": "object",
          "required": ["kind", "identifier", "revision", "format", "artifacts"],
          "properties": {
            "kind": { "const": "local" },
            "identifier": { "type": "string", "minLength": 1 },
            "revision": { "type": "string", "minLength": 1 },
            "format": { "type": "string", "minLength": 1 },
            "artifacts": {
              "type": "array",
              "minItems": 1,
              "uniqueItems": true,
              "items": { "$ref": "#/$defs/path" }
            },
            "configuration": {}
          },
          "additionalProperties": false
        }
      ]
    },
    "components": {
      "type": "object",
      "required": ["prompts", "toolSchemas"],
      "properties": {
        "prompts": {
          "type": "array",
          "minItems": 1,
          "uniqueItems": true,
          "items": { "$ref": "#/$defs/path" }
        },
        "toolSchemas": {
          "type": "array",
          "minItems": 1,
          "uniqueItems": true,
          "items": { "$ref": "#/$defs/path" }
        }
      },
      "additionalProperties": false
    },
    "candidate": {
      "type": "object",
      "required": ["credentials"],
      "properties": {
        "credentials": {
          "oneOf": [
            {
              "type": "object",
              "required": ["kind"],
              "properties": { "kind": { "const": "none" } },
              "additionalProperties": false
            },
            {
              "type": "object",
              "required": ["kind", "environment"],
              "properties": {
                "kind": { "const": "environment" },
                "environment": {
                  "type": "array",
                  "minItems": 1,
                  "uniqueItems": true,
                  "items": {
                    "type": "string",
                    "pattern": "^[A-Z][A-Z0-9_]*$"
                  }
                }
              },
              "additionalProperties": false
            }
          ]
        }
      },
      "additionalProperties": false
    }
  },
  "$defs": {
    "path": {
      "type": "string",
      "minLength": 1,
      "pattern": "^(?!/)(?!.*\\\\)(?!.*(?:^|/)(?:\\.|\\.\\.)(?:/|$))(?!.*//)[^/]+(?:/[^/]+)*$"
    }
  },
  "additionalProperties": false
}
