{
  "schemaVersion": "agentci.release.v2",
  "name": "agent-v2-idempotency-regression",
  "runtime": {
    "kind": "node-jsonl",
    "protocolVersion": 1,
    "entry": "candidate.mjs"
  },
  "bundle": {
    "root": "agent-v2.bundle"
  },
  "model": {
    "kind": "none",
    "reason": "Deterministic synthetic candidate with a planted idempotency regression."
  },
  "components": {
    "prompts": ["prompt.md"],
    "toolSchemas": ["tool-schema.json"]
  },
  "candidate": {
    "credentials": { "kind": "none" }
  }
}
